;review_text;sentiment;price;service;food
2489;how can people trust them if they do business like that!!! what's worse up to this day they still haven't informed me anything about the bill nor the blood test result itself;;;;
2490;the waiting time in the clinic is too long;;;;
2491;i always have to wait there for 30-50 minutes passed the appointment time;;;;
2492;i know the doctor is busy but the patient's time is precious too;;;;
2493;i don't like taking my work hours off and just wasting it on waiting for the doctor;;;;
2494;and when i finally get to meet with the doctor i can tell that she is not patient enough;;;;
2495;she seems in a hurry i know she wants to finish up our conversation asap and move on to the next patient;;;;
2496;they don't have xray machines;;;;
2497;if you are need to get some xray or ct scan done i suggest you going somewhere else even some small clinics have xray machines;;;;
2498;i normally only write positive reviews online but this time i want to let people know about what's really going on there;;;;
2499;i would not go there any more and i do not recommend lifescape to anybody;;;;
2500;i love the west side market but i can't stand the crowds the parking and the general gentrified douchery that seems to accompany the entire process;;;;
2501;for me it's just not worth it;;;;
2502;enter the food peddler farmer's market;;;;
2503;i don't know whose idea it was to plop down a produce-centric farmer's market style grocery store in the heart of cleveland's old brooklyn neighborhood but i'd like to shake their hand;;;;
2504;it's just what the doctor ordered;;;;
2505;imagine if you will a bright airy open market full of colorful fruit and vegetables from farms around the region rows of farm fresh eggs coolers filled with amish chicken and local ground beef;;;;
2506;yeah right;;;;
2507;no really it's true;;;;
2508;i'm not saying this place is perfect but for an area of cleveland more known for it's shady strip mall bars and giant cemeteries it's a breath of fresh air;;;;
2509;it does what cleveland and the rest of the nation needs it encourages consumption of fresh local foods;;;;
2510;so what do they have to offer?;;;;
2511;#NAME?;;;;
2512;#NAME?;;;;
2513;#NAME?;;;;
2514;#NAME?;;;;
2515;#NAME?;;;;
2516;#NAME?;;;;
2517;it's not as cheap as fast food no;;;;
2518;but if you're gonna spend your money somewhere why not make it your health;;;;
2519;i could go on and on about all of the products they've managed to cram into this place and about how friendly the staff was but i want to leave something for you to find out on your first visit;;;;
2520;i know it's not the west side market and it doesn't have nearly the sheer volume of items of this venerable food mecca but it's worth paying them a visit anyway;;;;
2521;what it does have is a neighborhood feel more parking and a more intimate experience;;;;
2522;support a local business eat local foods and give something back;;;;
2523;oh man this is going to be a long review so if you want the gist god awful do not go;;;;
2524;i was so dissapointed with everything that once i got home i had to write a review;;;;
2525;first of all i am vietnamese and pho is such a soulful dish the pho i had today was the worst thing ever;;;;
2526;my parents came to visit with my sister and a friend and after a long day we wanted to finish with a hot bowl of pho;;;;
2527;i have seen this place i have even walked by it when i ate at sura;;;;
2528;there was a smell so tantalizing that i had to go and try it;;;;
2529;i thought it would be a good idea to try jenni pho grill tonight;;;;
2530;we walk in saw that the place was not too busy maybe about 7 tables;;;;
2531;we got seated fairly quickly;;;;
2532;our server was pretty nice my parents attempted to order in vietnamese but the server informed us that he did not speak it;;;;
2533;cool cool no big deal he seemed like a nice kid;;;;
2534;after that it went downhill from there;;;;
2535;we ordered three bowls of the pho dac biet and two orders of the pho tai;;;;
2536;we finished our order with two thai teas the jenni jelly drink and two waters;;;;
2537;my family waited around no waters no drinks nothing;;;;
2538;we watched three tables get seated order their food and get their food before we even had anything on our table!  after a 25 min wait our waiter finally comes back with two waters;;;;
2539;we asked why the service was so slow he stated that there was only two waiters and said sorry;;;;
2540;so it was fine for now;;;;
2541;after we got the water nothing else came to us;;;;
2542;we watched as the tables that came in after us eat and one even finished before we were served;;;;
2543;after another 35 minutes our food finally came out;;;;
2544;first the two dac biet bowls then the last three;;;;
2545;finally the drinks came out as well;;;;
2546;i have worked at a boba place before making thai teas should not take a hour;;;;
2547;for waiting for so long i was really anticipating for a great bowl of pho;;;;
2548;oh man was i wrong;;;;
2549;the broth was lukewarm it could not even finish cooking my meat;;;;
2550;the broth tasty funky as if it was made with a pre made powder;;;;
2551;my parents and i watched a one cook was constantly tasting the broth and we saw no bones that make a great broth;;;;
2552;the bowl was mostly disappointing broth;;;;
2553;there were very little meat and noodles;;;;
2554;we ate and we wanted to get out as soon as possible;;;;
2555;we asked for a to go cup for the thai tea because it took so long we were just going to take it home;;;;
2556;it took almost another five minutes just to get a plastic cup;;;;
2557;in the end it was just terrible;;;;
2558;my family and i went home unhappy;;;;
2559;and the thing is i love food i work in the industry so i timing is very important;;;;
2560;having only two servers is rough but it can not be the only excuse;;;;
2561;if there was something wrong or if it was going to take a little longer they should inform the customers;;;;
2562;the worst part was watching tables come in before us and eat before we got anything;;;;
2563;i am never going back;;;;
2564;i really hope they clean up their act there are a lot of pho places out here and if they don't fix things it will be buried beneath the rest;;;;
2565;great wings  and the breakfast is pretty good also;;;;
2566;the cook does a great job on the food;;;;
2567;i don't drink so i can't say anything about that but over all a good neighborhood place;;;;
2568;worst service ever;;;;
2569;only one here and took 10 minutes to get one drink out;;;;
2570;3 people behind the counter including the manager;;;;
2571;they were all talking and doing other things;;;;
2572;driving late at night we were lucky to find the last room available at this location;;;;
2573;the front desk clerk breanne was super nice and helpful;;;;
2574;the hotel felt welcoming and clean walking in and the room was no different! i'd definitely stay again;;;;
2575;we did not explore the other amenities;;;;
2576;christian and joe!! 5 stars!;;;;
2577;thanks for the quick resolution!;;;;
2578;got the tech scheduled as best they could as quick they could and we're professional the whole time;;;;
2579;their is a bit of a disconnect from the moment you arrive in the parking lot as the signage makes a cool sophisticated impression that does not match the semi-bland interior;;;;
2580;this could be any of the relatively higher chain restos that feels like it needs an update but maybe that's just me?;;;;
2581;the food is the thing in any restaurant and pretty much everything was just ok;;;;
2582;our salesman/server;;;;
2583;) confidently stated the steak tacos were the best menu item and they were but still only rated a just above average 3;;;;
2584;i had a ribeye with mashed and seasonal vegetables that was not coked to medium as requested (who knows why they ask in spots like this because it is pretty much never done right?);;;;
2585;the accompanying sauce was actually very good and that saved this dish for me;;;;
2586;if union social was located closer to where we live it might merit another chance but we live in the south end of mississauga and thus will be sticking closer to home;;;;
2587;--look at my picture!!!;;;;
2588;this is a picture of an **insect that i was about to eat!! i was really hungry and decide to stop by and eat;;;;
2589;thank goodness this was my second plate and i wasn't too full because i gulped down the first plate;;;;
2590;this is your soup of toscana that i was served;;;;
2591;management provided a friendly compensation but i don't want anyone to get poisoned sooo yeah eat at your own risk!!;;;;
2592;im obsessed with this place! best dishes to try include;;;;
2593;pozole- which is really filling! great for when is freezing outside;;;;
2594;tacos dorados- they are the best ones i have tried in the city!;;;;
2595;enchiladas during the morning on weekends are the best as well delicious! and if you really want to try real huevos rancheros try them here!!!!! there are some other places in the neighbourhood to claim to offer them and trust me none of the are authentic as they are here;;;;
2596;always a great experience keep the good work! prices are so good also considering the freshness and quality of food one of the best places to eat without breaking your pocket;;;;
2597;the challah french toast paired with turkey bacon was a pretty awesome breakfast and i thoroughly enjoyed it;;;;
2598;however i felt the staff was lacking in service;;;;
2599;they were very nice just not very prompt and would disappear for quite some time;;;;
2600;i don't know if it was because a few people called out and they were short-staffed or if one should plan to stay awhile;;;;
2601;the food is very good though;;;;
2602;trã¨s grand cafã© mais aussi calme et reposant je m'y suis arrãªtã© alors que j'ã©tais dans le coin;;;;
2603;on peu y mangã© le midi prendre une pã¢tisserie ou un cafã©/thã©;;;;
2604;j'ai prit un thã© qui ã©tait vraiment bon et je me suis posã© devant une des grandes baies vitrã©es sur un coussin et j'ai relaxã© complã¨tement pendant 2 heures;;;;
2605;mais c'est aussi une coopã©rative d'artiste avec une estrade etc;;;;
2606;il y a aussi un magasin bio ã  l'entrã©e oã¹ vous retrouverez des savons huile d'olive et plein d'autres produits;;;;
2607;the food was great our server karu was the bomb he was cool very nice and good looking guy;;;;
2608;it's the perfect spot for the bring friends and group;;;;
2609;great atmosphere and great menu choices;;;;
2610;spicy;;;;
2611;but its good haha;;;;
2612;defenitely coming back!!!;;;;
2613;chilaquiles is on point;;;;
2614;i bought them last and saved them for breakfast today;;;;
2615;the sauce and tortillas were so good!;;;;
2616;i e-mailed head office months ago about a lousy experience at their yonge & college street location and never received a response;;;;
2617;was never a huge fan to begin with but that confirmed things for me;;;;
2618;oh and the cobb salad doesn't have chicken in it anymore;;;;
2619;what a rip off!;;;;
2620;awful;;;;
2621;nearly inedible;;;;
2622;even for airport food;;;;
2623;"don't push the ""prompt service"" button on the table";;;;
2624;the waitress said that they ignore it;;;;
2625;keep walking;;;;
2626;much better coffee than the big chains;;;;
2627;this is a great place for a quick lunch or breakfast and the drive through makes caffeine fill ups easy;;;;
2628;i used to work for skechers in las vegas years ago;;;;
2629;everything at this store is the same;;;;
2630;except this store is much smaller! especially the clearance section;;;;
2631;i tried on some shoes;;;;
2632;and that was it really;;;;
2633;we were greeted but no one checked up on me blah oh well;;;;
2634;this restaurant is a real local secret;;;;
2635;open since 1965 the original owner and chef was still cooking in the kitchen on a monday night at 10;;;;
2636;00 when most restaurants were closed;;;;
2637;so happy i found it;;;;
2638;amazing food wonderful authentic italian atmosphere and friendly and well-timed  service in english french or italian!;;;;
2639;just a couple days ago i adopted my little sayuri from the arizona humane society;;;;
2640;the entire process was seamless and it was evident it was in the societies best interest to make sure these lovable pets find the right home;;;;
2641;i first went in to see a couple of puppies and i really like 2 in particular;;;;
2642;because i already have a dog at home and my boyfriend wasn't able to join me i put one of them on hold (they will hold your pet for the day) and went back a few hours later;;;;
2643;it is required that if you already have a dog you must do an introduction to make sure it is a good match;;;;
2644;my dog loved sayuri but was not as fond of the other dog;;;;
2645;i like to say that my dog chose our new puppy;;;;
2646;when adopting a puppy you also recieve a free exam through the vca animal hospitals;;;;
2647;i think that's wonderful since adopting a rescue dog can be intimidating;;;;
2648;overall the facility is extremely clean the staff is more than helpful and on top of it all they are about as friendly as you can imagine;;;;
2649;these people have hearts of gold;;;;
2650;i would absolutely recommend the az humane society to anyone who wants to add to their family;;;;
2651;this is for service only;;;;
2652;on a 2000 honda accord vtec ex;;;;
2653;had major service done here;;;;
2654;timing belt water pump tune up etc;;;;
2655;basically everything that was recommended and told needed to be done;;;;
2656;wanted the car to be reliable and not have any issues so i went ahead with all the required maintenance and then some;;;;
2657;1 month after all this major service the radiator blew open coming back from flagstaff;;;;
2658;ok so i understand things break etc;;;;
2659;i take it to arrowhead honda service and the explanation was since i replaced the water pump with a new one it must have increased pressure in the system;;;;
2660;since the radiator was old the new water pump found a weakness in the radiator;;;;
2661;i was then told it was common??? ok i get the explanation but if that was the case a month a go and common knowledge why not recommend replacing the radiator with the major service so the car would not leave me stranded???;;;;
2662;they also had recommended the power steering pump be replaced system flushed etc;;;;
2663;hate when its not done right the first time?  had to bring it back and wait for them to get air out of the system so the new power steering pump would stop making noise;;;;
2664;i went to this dealership service department because they know honda's better then me and what breaks unfortunately even when i changed everything they initially recommended they still missed other items that should of been changed;;;;
2665;i have not been back since this mistake;;;;
2666;roach and staff are wonderful;;;;
2667;keisha is an amazing groomer too! we love this place;;;;
2668;it is clean efficient and a state of the art facility;;;;
2669;i love this location;;;;
2670;christina was our server this morning and she was fantastic;;;;
2671;as a former waitress i understand how hectic and overwhelming a morning shift can get but she was attentive and very friendly and always kept her cool even with the tons of tables she had;;;;
2672;the food was brought to us within ten minutes of ordering (successfully taming the hangry beast that was brewing) and any modification to our order was done correctly! the food itself was pretty good;;;;
2673;#NAME?;;;;
2674;overall i was very impressed with this recent visit;;;;
2675;keep up the good work!;;;;
2676;good luck getting an appointment  before you end up in the e;;;;
2677;i'm not into seafood but it was my husbands birthday and he loves it;;;;
2678;there were other options then seafood that made me happy;;;;
2679;and my husband said his was great;;;;
2680;this review is for just the gym facilities as i've never tried the tanning or purchased any products;;;;
2681;there's a solid array of cardio equipment weight machines and free weights (including an olympic lifting platform/power cage combo with bumper plates another power cage and a smith machine);;;;
2682;the pros;;;;
2683;24 hours access with your keycard;;;;
2684;no-contract membership options;;;;
2685;lockers (bring your own lock);;;;
2686;sweat towels provided;;;;
2687;friendly employees;;;;
2688;the cons;;;;
2689;no showers;;;;
2690;inconsistent membership rates (my friends got quoted several different rates than what i pay);;;;
2691;small space can get packed;;;;
2692;some of the equipment is showing signs of wear (ripped pads on weight machines and cracks in the weight benches pads and the numbers have rubbed off on some of the dumbbells so you can't tell what the weight is;;;;
2693;i wouldn't think it would be that hard to slap some stickers on there but it's been that way for months;;;;
2694;often dirty - especially the mirrors in front of the power cages which always have peoples' spit sprayed all over them;;;;
2695;i have personally wiped weird black/brown splotches off the olympic lifting platform (are people shitting themselves during squats??) and it's always built up again the next time i go;;;;
2696;overall it's a decent gym that gets the job done if you live in the area;;;;
2697;the service was pretty bad;;;;
2698;there were these two grouchy ladies dealing with us at the entrance and we have to wait ridiculously long for a table even though the restaurant is almost empty;;;;
2699;then we have to sit as far away from the food as possible;;;;
2700;when we ask to sit closer they say no;;;;
2701;we ask why and they say no one is covering that area;;;;
2702;seems like they could easily fix that or make one exception i mean its a buffet;;;;
2703;we won't be needing much service if any;;;;
2704;luckily that lady who took our drink orders was pretty nice and came over often to clear our plates and refill our mimosas;;;;
2705;the food at the buffet was one of the better buffets i've had in vegas definitely better than monte carlo's or harrah's but nothing compared to paris or mirage;;;;
2706;i was told caesar's palace is the best but i've never had it;;;;
2707;from the looks of it i'm sure its a million times better than this place;;;;
2708;if you want a relatively less expensive buffet where most of the food is tasty and there's a fair amount of variety you might want to go here especially for the mimosa's;;;;
2709;we got a great deal from tix4tonight;;;;
2710;definitely check out tix4tonight or a service like it before you go anywhere in vegas;;;;
2711;one really cool feature here is the salad bar where they make you a salad fresh for you;;;;
2712;i really enjoyed the chinese chicken salad;;;;
2713;there's also a dessert area that has more choices than a lot of the other buffets though the execution of them aren't so great;;;;
2714;definitely worth going to for the food but i really thought the service was the worst out of all the restaurants i went to in vegas;;;;
2715;for those reasons i probably won't go back but i wouldn't tell people not to go;;;;
2716;my companion and i went to living kitchen on an impulse and am very happy to say it was delicious and worth it! my companion got the arugula harvest salad and i got the pad thai;;;;
2717;the arugula harvest salad was very tasty and all of the components came together well;;;;
2718;the pad thai was also very flavorful and had an awesome sauce which had a good afterburn to it;;;;
2719;i would highly recommend coming here to try the food vegan vegetarian or otherwise;;;;
2720;why do these guys suck? how hard is it to ring a bell to see if the receiver is home?  i've had multiple issues with them and wish amazon would stop using them;;;;
2721;this place brings back so many memories with my family;;;;
2722;it has been here for years and unfortunately the service and food quality has gone down;;;;
2723;during my recent visit i noticed they closed down the second half of the seating area which is disappointing in my book;;;;
2724;i go here with my family and we are usually big party so they would  accommodated just fine but now we had to separate the family and sit at different tables or booths just to all fit;;;;
2725;poor choice in closing the extra room after all these years;;;;
2726;the service for the food depends on the day and if glendale is hosting a event;;;;
2727;i don't recommend lunch or dinner here but the breakfast is like any ordinary restaurant;;;;
2728;i was on  cleanse one weekend and they were awesome enough to give me egg whites even though it wasn't on the menu;;;;
2729;we went for brunch;;;;
2730;shrimp sushi snow crab legs crepes made to order prime rib etc;;;;
2731;etc;;;;
2732;add all you can drink mimosas and we were loving it;;;;
2733;00 for two after tip;;;;
2734;would go back for sure;;;;
2735;this is the worst gym i've ever been to and i've grown up in the gym business;;;;
2736;these guys only care about your money and nothing more;;;;
2737;when i joined i later had to cancel with them because i had to meet with my national guard unit and i didn't know what kind of schedule i'd have;;;;
2738;they seemed understanding and said it wasn't a problem;;;;
2739;at this time i would have rated this gym very good because i had fun with no issues;;;;
2740;i even told them i'd probably start back up here after i know what schedule looked like;;;;
2741;so i stop going after my month expired because i cancelled(even on my attendance sheet it said it was my last and only month;;;;
2742;) i later check my bank statement and they charged me again okay no big deal probably a mistake;;;;
2743;i call them no answer;;;;
2744;okay that's fine i'll email them explaining the mistake;;;;
2745;i'll give them a few days to get back to me max;;;;
2746;hear nothing from them;;;;
2747;call them again no answer;;;;
2748;call them again they finally answered;;;;
2749;"i explain the situation with guy that answers and he says ""oh yeah i got your email but i forgot to call you";;;;
2750;at this point i'm a little rubbed wrong with they're crap customer service;;;;
2751;then after that he tells me no i haven't cancelled and i'm going to have to pay another two months worth;;;;
2752;he tells me i must have misunderstood him (he speaks broken english so he must have misunderstood me when i cancelled with him a month prior to this);;;;
2753;he won't help me out at all just says i have to pay more;;;;
2754;thank god i have navy federal for a bank because i call them after this and they let me know these guys shouldn't be changing me;;;;
2755;they repay me for what the gym took and put a dispute on the gym they also put a stop payment on the gym;;;;
2756;well sure and behold i get charged by them again and i call my bank asking why did this happen? turns out this gym is manually putting my card information in to get past the stop payment;;;;
2757;i ask what i can do;;;;
2758;they say to email them so i have proof i contacted them in case they try to lie;;;;
2759;so i email these dirt bags and guess what once again nothing but they email me the schedule for the classes;;;;
2760;once again my bank is helping me thank goodness;;;;
2761;not veteran friendly;;;;
2762;freaking bomb macaroni & cheese and everything else was awesome as well great service again everything was outstanding;;;;
2763;i ordered the akropolis pizza and pork gyro;;;;
2764;the first thing i noticed when the pizza came out was how vibrant the toppings were! you can tell the veggies are fresh just by looking at them;;;;
2765;the gyro was one of the best i've had and the fries were awesome;;;;
2766;great service! they really care about giving you a good experience;;;;
2767;i will definitely be back!;;;;
2768;worst experience ever;;;;
2769;i guess it's my first time left negative comments but definitely for me won't go back anymore;;;;
2770;i have made reservation for the day and when i arrive they told me they don't remember they have confirmed my appointment n already other guests waiting there but they re closing in a hour;;;;
2771;still the lady told me it's ok they could do it;;;;
2772;so i sit down n soak my feet into cold water;;;;
2773;n after 20 mins the lady told me n another girl that actually they could not help us today as they re closing soon n one of the staff actually have to leave soon;;;;
2774;so i don't know how good they re as i guess i ll never know;;;;
2775;so let me start out;;;;
2776;the ambiance of the facility is amazing;;;;
2777;very classy;;;;
2778;but that doesn't compensate for the service i received;;;;
2779;i was the first person at the door and when we walk in we're notified that there is a 30 minute wait for preparation;;;;
2780;i honestly feel they should have came in 30 mins earlier instead of making a customer wait;;;;
2781;i was a little disappointed that 2 groups of women with sundresses came in 30 mins after me and received their food before me;;;;
2782;there has to be a happy medium;;;;
2783;"it's not right to let the ""sex sells"" slogan consume your site of all customers being treated fairly and equally";;;;
2784;to be honest i wish had just went to ihop but i tried to be a good person and support black business;;;;
2785;this place will not be recommended to anybody i know;;;;
2786;the food on a scale of a 1-10 was a 7 if the service was better i'd give a 8;;;;
2787;my meal was the salmon and grits;;;;
2788;being an avid hookah smoker with a pipe of my own i probably have a little more knowledge about shisha and the procedures than i need with that being known this place doesn't clean the pipes after each use and as stated with another review it really doesn't matter a whole lot what flavor you are interested in double apple is what you will eventually end up tasting;;;;
2789;they use standard bowls to hold the shisha and you get 2 pieces of quick light charcoal;;;;
