;review_text;sentiment;price;service;food
0;total bill for this horrible service? over $8gs;;;;
1;these crooks actually had the nerve to charge us $69 for 3 pills;;;;
2;i checked online the pills can be had for 19 cents each! avoid hospital ers at all costs;;;;
3;i *adore* travis at the hard rock's new kelly cardenas salon!  i'm always a fan of a great blowout and no stranger to the chains that offer this service;;;;
4;however travis has taken the flawless blowout to a whole new level!;;;;
5;travis's greets you with his perfectly green swoosh in his otherwise perfectly styled black hair and a vegas-worthy rockstar outfit;;;;
6;next comes the most relaxing and incredible shampoo -- where you get a full head message that could cure even the very worst migraine in minutes --- and the scented shampoo room;;;;
7;travis has freakishly strong fingers (in a good way) and use the perfect amount of pressure;;;;
8;that was superb!  then starts the glorious blowout;;;;
9;where not one not two but three people were involved in doing the best round-brush action my hair has ever seen;;;;
10;the team of stylists clearly gets along extremely well as it's evident from the way they talk to and help one another that it's really genuine and not some corporate requirement;;;;
11;it was so much fun to be there!;;;;
12;next travis started with the flat iron;;;;
13;the way he flipped his wrist to get volume all around without over-doing it and making me look like a texas pagent girl was admirable;;;;
14;it's also worth noting that he didn't fry my hair -- something that i've had happen before with less skilled stylists;;;;
15;at the end of the blowout & style my hair was perfectly bouncey and looked terrific;;;;
16;the only thing better?  that this awesome blowout lasted for days!;;;;
17;travis i will see you every single time i'm out in vegas;;;;
18;you make me feel beauuuutiful!;;;;
19;i have to say that this office really has it together they are so organized and friendly!  dr;;;;
20;phillipp is a great dentist very friendly and professional;;;;
21;the dental assistants that helped in my procedure were amazing jewel and bailey helped me to feel comfortable!  i don't have dental insurance but they have this insurance through their office you can purchase for $80 something a year and this gave me 25% off all of my dental work plus they helped me get signed up for care credit which i knew nothing about before this visit!  i highly recommend this office for the nice synergy the whole office has!;;;;
22;went in for a lunch;;;;
23;steak sandwich was delicious and the caesar salad had an absolutely delicious dressing with a perfect amount of dressing and distributed perfectly across each leaf;;;;
24;i know i'm going on about the salad;;;;
25;but it was perfect;;;;
26;drink prices were pretty good;;;;
27;the server dawn was friendly and accommodating;;;;
28;very happy with her;;;;
29;in summation a great pub experience;;;;
30;would go again!;;;;
31;today was my second out of three sessions i had paid for;;;;
32;although my first session went well i could tell meredith had a particular enjoyment for her male clients over her female;;;;
33;however i returned because she did my teeth fine and i was pleased with the results;;;;
34;when i went in today i was in the whitening room with three other gentlemen;;;;
35;my appointment started out well although being a person who is in the service industry i always attend to my female clientele first when a couple arrives;;;;
36;unbothered by those signs i waited my turn;;;;
37;she checked on me once after my original 30 minute timer to ask if i was ok;;;;
38;she attended my boyfriend on numerous occasions as well as the other men and would exit the room without even asking me or looking to see if i had any irritation;;;;
39;half way through another woman had showed up who she was explaining the deals to in the lobby;;;;
40;while she admits timers must be reset half way through the process she reset my boyfriends left rest the gentleman furthest away from me who had time to come in redeem his deal get set and gave his timer done before me then left and at this point my time was at 10 minutes;;;;
41;so she should have reset it 5 minutes ago according to her;;;;
42;while i sat there patiently this whole time with major pain in my gums i watched the time until the lamp shut off;;;;
43;not only had she reset two others explained deals to other guest but she never once checked on my time;;;;
44;when my light turned off i released the stance of my mouth to a more relaxed state assuming i was only getting a thirty minute session instead of the usual 45 because she had yet to come in;;;;
45;at this point the teeth formula was not only burning the gum she neglected for 25 minutes now but it began to burn my lips;;;;
46;i began squealing and slapping my chair trying to get her attention from the other room in a panic;;;;
47;i was in so much pain that by the time she entered the room i was already out of my chair;;;;
48;she finally then acknowledged me and asked if she could put vitamin e on my gum burn (pictured below);;;;
49;at this point she has treated two other gums burns while neglecting me and i was so irritated that i had to suffer all i wanted was to leave;;;;
50;while i waited for my boyfriend she kept harassing me about the issue;;;;
51;"saying ""well burns come with teeth whitening";;;;
52;""" while i totally agree and under justifiable circumstances would not be as irritate it could have easily been avoid if she had checked on me even a second time so i could let her know";;;;
53;not only did she never check on my physical health she couldn't even take two seconds to reset the timer which she even admitted to me;;;;
54;her accuse was that she was coming in to do it but i had the light off for a solid two minutes before i couldn't stand the pain;;;;
55;she admitted it should be reset every 15 minutes which means for 25 minutes she did not bother to help me at all;;;;
56;her guest in the lobby then proceeded to attack me as well simply because i wanted to leave after the way i was treated;;;;
57;i also expected a refund for not getting a complete session today due to the neglect and the fact i won't be returning for my last she had failed to do that;;;;
58;she was even screaming from the door and continued to until my boyfriend and i were down the steps;;;;
59;"i have never in my life been more appalled by a grown woman's behavior who claims to be in the business for ""10 years";;;;
60;""" admit your wrongs but don't make your guest feel unwelcome because you can't do you job properly";;;;
61;i'll be the first to admit that i was not excited about going to la tavolta;;;;
62;being a food snob when a group of friends suggested we go for dinner i looked online at the menu and to me there was nothing special and it seemed overpriced;;;;
63;im also not big on ordering pasta when i go out;;;;
64;alas i was outnumbered;;;;
65;thank goodness! i ordered the sea bass special;;;;
66;it was to die for;;;;
67;cooked perfectly seasoned perfectly perfect portion;;;;
68;i can not say enough good things about this dish;;;;
69;"when the server asked how it was he seemed very proud of the dish and said "" doesn't she (the chef) do an incredible job?"" she does";;;;
70;my hubby got the crab tortellini and also loved his;;;;
71;"i heard ""mmmm this is so good"" from all around the table";;;;
72;our waiter was super nice and even gave us free desserts because we were some of the last people in the restaurant;;;;
73;service was very slow and the place was packed but we had our jugs of wine and a large group with good conversation so it didn't seem to bother anyone;;;;
74;so-;;;;
75;do order the calamari and fried zucchini appetizers;;;;
76;leave out the mussels;;;;
77;if they have the sea bass special i highly recommend it;;;;
78;the chicken parm and crab tortellini were also very good and very big;;;;
79;the chicken romano was a bit bland;;;;
80;the house salads were teeny;;;;
81;do make a reservation but still expect to wait for your food;;;;
82;go with a large group of people and plan for it to be loud;;;;
83;don't go with a date unless you're fighting and don't feel like hearing anything they have to say;;;;
84;ask to sit in the side room if it's available;;;;
85;tracy dessert had a big name in hong kong and the one in first markham place has been here for many years now!;;;;
86;came in for some chinese dessert and i must say their selection has increased tremendously over the years;;;;
87;i might as well add that the price has also increased tremendously as well;;;;
88;the waitress gave us tea which i could taste had red date in it;;;;
89;fancy!;;;;
90;a simple taro with coconut with tapioca pearls was like $5;;;;
91;25 or something;;;;
92;basically all the desserts were more than $5;;;;
93;that's crazy! i can literally just make this dessert at home and for a bowl it would probably cost like $0;;;;
94;a few years ago i think i can still get it for like $3-$4 which is more reasonable but wow more than $5 is a little over the top for this dessert;;;;
95;though i must say it is tracy dessert and they are a little more on the expensive side;;;;
96;i also saw other items on the menu like fish balls chicken wings shaved ice;;;;
97;my friend got a mango drink with fresh mango in it!;;;;
98;i'm also surprised how many people come to tracy dessert after work;;;;
99;we came on a sunday and the tables were always filled;;;;
100;i think the amount of tables they had were just perfect because no one really waited for seats for a long time but the tables kept filling up once a table was finished;;;;
101;this place has gone down hill;;;;
102;clearly they have cut back on staff and food quality;;;;
103;many of the reviews were written before the menu changed;;;;
104;i've been going for years and the food quality has gone down hill;;;;
105;the service is slow & my salad which was $15 was as bad as it gets;;;;
106;it's just not worth spending the money on this place when there are so many other options;;;;
107;i was really looking forward to visiting after having some of their beers;;;;
108;"the ""man o'war"" quickly became my favorite dipa";;;;
109;the rusulka vanilla stout is a good thick sweet stout;;;;
110;and the ironclad is a top notch ipa;;;;
111;the only big miss on their beers i've had is the big chuck barleywine;;;;
112;it could probably benefit greatly with age but at this age all there is to taste is the alcohol;;;;
113;nonetheless i had enough to convince me that the other beers i hadn't had from them would be top notch;;;;
114;and they are!;;;;
115;the reason for the 2 stars should not reflect the quality of the brewers they obviously know their craft well!;;;;
116;the servers are great and friendly;;;;
117;but relying on two servers to wait on 100+ customers says a lot about how inexperienced management must be;;;;
118;in fact after waiting 15 mins at a dirty table i was finally able to track down someone i guessed was an employee to let them know we were even there!;;;;
119;after another 5+ mins the gm finally stopped over to take our drink order;;;;
120;the smugness of this guy was amazing;;;;
121;the thought of offering a simple apology never seemed to enter into his head;;;;
122;this is the time a server finally stopped by to pick up the non-final check left by the party before us;;;;
123;who didn't seem very pleased when leaving;;;;
124;the toast & cheese was good but by the time we were able to dig into their heartiest offering of food saltines and butter may have been equally pleasing;;;;
125;it's a giant best buy with 66 registers;;;;
126;i don't get it;;;;
127;what's the big deal about this place??;;;;
128;like walking back in time every saturday morning my sister and i was in a bowling league and after we were done we'd spend a few quarters playing the pin ball machines until our mother came to pick us up;;;;
129;"my sister was daring and play the machines hard she was afraid of that ""tilt"" showing up and freezing the game";;;;
130;i on the other hand was a bit more gentler and wanted to make sure i got my quarter's worth;;;;
131;this place has rows and rows of machines some are really old and some are more of a mid 80's theme;;;;
132;there is even a ms pac man!  it was fun to spend an afternoon playing the machines and remembering all the fun of my early teen years;;;;
133;walked in around 4 on a friday afternoon we sat at a table just off the bar and walked out after 5 min or so;;;;
134;don't even think they realized we walked in;;;;
135;however everyone at the bar noticed we walked in!!! service was non existent at best;;;;
136;not a good way for a new business to start out;;;;
137;oh well the location they are at has been about 5 different things over the past several years so they will just be added to the list;;;;
138;smdh!!!;;;;
139;wow;;;;
140;so surprised at the one and two star reviews!  we started with the most tender calamari;;;;
141;although the marinara sauce was a bit bland but a touch of salt made it just right;;;;
142;my husband had the veal with peppers and said it was so delicious and tender;;;;
143;the mashed potatoes were perfect;;;;
144;i had the salmon diablo which was also delicious;;;;
145;our salad was beautiful! dressing was served on the salad and it was a nice amount;;;;
146;we ended our delicious meal with a piece of tiramisu;;;;
147;our server matt was right on!! very pleasant and knowledgeable about the menu;;;;
148;our appetizer salad and entrees were timed perfectly;;;;
149;i love salad and did not mind that my entree was served while i was still eating it! no problem it let my dinner cool to just the right temp for me to eat it comfortably;;;;
150;i wonder sometimes if people just don't appreciate relaxing and taking time to eat a wonderful and beautifully prepared meal;;;;
151;a wonderful atmosphere;;;;
152;so relaxing;;;;
153;the chairs are super comfortable too!!! we will certainly be back;;;;
154;give it a try;;;;
155;don't  always go by the reviews;;;;
156;a bottle of riesling calamari app two delicious entrees and dessert for $92!;;;;
157;well with it;;;;
158;michael from red carpet vip is amazing ! i reached out because i needed help planning my soon to be sister in law's bachelorette;;;;
159;it was a group of 10 girls so i was a little overwhelmed but michael saved the day! everything was super smooth and easy! we got good deals and had the best time ever! we booked hotel and a bachelorette package for a great price;;;;
160;i have saved contact info because i will for sure reach out again on next vegas trip!!!;;;;
161;i cannot believe how things have changed in 3 years;;;;
162;i picked up duck congee sometime in the winter when my hubby was sick;;;;
163;i was very disappointed because the ginger fish sauce tasted like it had gone bad (it should never be bitter);;;;
164;today my hubby wanted to eat there since he was craving the duck congee and most places don't serve the duck & coleslaw side;;;;
165;we waited about 10 minutes to get our menu;;;;
166;after we placed our orders we waited another 5 minutes to get the tea that most places bring with the menu;;;;
167;i could go on with the details but the gist of the story is they were understaffed or the staff was slow;;;;
168;the worst part of it was that the service;;;;
169;the servers make us feel bad for asking for anything (like when they took our order);;;;
170;we had arrived and placed our order before another couple bside us at least 10 minutes ahead but somehow this couple received their pho before mine;;;;
171;they were almost done eating their pho before mine came out;;;;
172;you can't really find anything wrong with this place the pastas and pizzas are both amazing and high quality the price is very reasonable the owner and the staff are very friendly if you're in downtown check this place out a lot of people think just because it's downtown there are lots of options around but that's not always the case as there is also a lot of poor quality food in downtown as well;;;;
173;great lunch today;;;;
174;staff was very helpful in assisting with selections and knowledgeable on the ingredients;;;;
175;we enjoyed the bbq chicken with tika masala sauce and really good naan bread;;;;
176;the biryani with chicken was also yummy! fun to see the food being prepared in the tandoori ovens;;;;
177;great addition to the fast casual scene in cleveland;;;;
178;i love chinese food and i love mexican food;;;;
179;what can go wrong? a couple of things;;;;
180;"first things first this place is more of a ""rice bowl"" kind of place";;;;
181;i thought it was going to be more diverse as far as the menu goes but its mainly rice bowls you get with different kinds of meats;;;;
182;the ordering was a little confusing at first but one of the employees helped us out and i got the 2-item bowl and got the jade chicken and hengrenade chicken with all rice(jerk);;;;
183;i also ordered a jade chicken quesadilla on the side;;;;
184;i'm gonna admit this place looks kinda dirty;;;;
185;"i don't think arizona uses those health department letter grade system like california does but if i were to just judge by how it looked inside i'd give it a ""c"" grade lol";;;;
186;we waited for about 15 minutes or so and finally got our food;;;;
187;we took it to go and ate at our hotel room;;;;
188;mmmm;;;;
189;the food was just alright;;;;
190;the jade chicken was nothing special;;;;
191;it tasted like any generic chinese fast food orange chicken/sesame chicken variant;;;;
192;the hengrenade chicken although was the less spicier version of the jerk chicken was still pretty spicy for me;;;;
193;just be warned the jerk chicken is super spicy;;;;
194;if you aren't sure ask for a sample at the restaurant before ordering but it was way too spicy for me;;;;
195;the jade chicken quesadilla was decent but nothing special;;;;
196;just imagine orange chicken in between a tortilla and cheese;;;;
197;a friend of mine ordered a jade chicken burrito and we were confused when we pulled it out of the bag because it was literally the size of mcdonald's apple pie;;;;
198;if you order the burrito be warned that it's a burrito for gnomes and smurfs but he said it was tasty;;;;
199;they provide a snicker doodle sugar cookie for each meal and it was decent again nothing special;;;;
200;not gonna lie the next day my stomach felt like a little mexican dude and chinese dude were wrestling and throwing molotov cocktails inside;;;;
201;i used the bathroom like 5 times;;;;
202;i don't recommend eating this place if you have a lot to do the next day;;;;
203;we've been a huge slim's fan since they opened one up in texas about two years ago when we used to live there;;;;
204;this place never disappoints;;;;
205;they even have great salads and grilled chicken;;;;
206;plus they have fresh brewed sweet tea it's the best!;;;;
207;good selection of classes of beers and mains;;;;
208;i've been here twice;;;;
209;first time i had the fried chicken;;;;
210;it was delicious but be warned extremely salty;;;;
211;i couldn't even finish the last piece of chicken after experiencing a salt overload;;;;
212;second time we came on a wednesday;;;;
213;we didn't know it was bbq night where they have a completely different menu and don't offer anything from their original vegetarian-friendly menu;;;;
214;this menu has one vegetarian-friendly option - an eggplant sandwich;;;;
215;the vegetarian in my party said it was awful;;;;
216;also on bbq night you choose 2 sides;;;;
217;except they were out of all their sides except 2 - fries and potato salad;;;;
218;i can't say i was thrilled to have carb heavy sides with my carb heavy main;;;;
219;how do you run out of sides so early in the evening?;;;;
220;service not so great;;;;
221;i'd avoid coming here on wednesdays;;;;
222;our family loves the food here;;;;
223;quick friendly delicious and a great restaurant to take kids to;;;;
224;5 stars!;;;;
225;if you are looking for the best pierogies in pittsburgh this is your place;;;;
226;there are a few small tables outside but most of the business is carry out;;;;
227;pierogies plus wins best pierogies every year;;;;
228;why? because the owner is from poland and she is making the real deal pierogies;;;;
229;the best part is that they are hand pinched by a group of older polish and hungarian women;;;;
230;the biggest seller is potato and cheese but they sell many flavors;;;;
231;they are like plump pillows of softness;;;;
232;you can buy them buy the dozen;;;;
233;you can get them cold to take home and freeze or warm and ready to eat;;;;
234;the warm ones are served with butter and onions;;;;
235;it's definitely a comfort food;;;;
236;the best part is that they ship internationally;;;;
237;yes they are that good;;;;
238;the food is always good and the prices are reasonable;;;;
239;although it's not exactly a restaurant -- more like a snack bar limited menu and you walk up to the counter place your order wait a minute or so for them to prepare your order and pay the cashier then search for a table;;;;
240;kind of like a sandwich shop;;;;
241;still a much better choice for value than the other hotel deli's on the strip;;;;
242;pick any meat on the planet and the chef will make a mexican style dish with amazing flavor! wow fish and lamb tacos to die for;;;;
243;drinks are great as well;;;;
244;great food great service;;;;
245;obviously fried chicken isn't the healthiest food on earth but once a month i get that craving for good fried chicken;;;;
246;their chicken is great doesn't seem too fatty and their sides are excellent too;;;;
247;plumbsmart provided superior service from beginning to end;;;;
248;they were able to repair a badly damaged sewer pipe with only one day's notice;;;;
249;i was particularly pleased with their attention to care when cleaning up the landscape after the job was completed;;;;
250;their competitive pricing and excellent service make them my first stop for all future plumbing needs;;;;
251;thank you to wayne and the whole team!;;;;
252;#NAME?;;;;
253;unfortunately i must recommend not to conduct any business with fast fix jewelry and watch repairs;;;;
254;the staff is completely unprofessional and i have never been treated so rudely in my life;;;;
255;"i was actually shocked and walked away thinking ""wow how do those people even have a job?""";;;;
256;i have never written a negative review before i usually chalk it up to someone having a bad day;;;;
257;i have worked in customer service for 10+ years and i know it is exhausting and bad days happen;;;;
258;but this is a special occasion;;;;
259;i drove 30 minutes to try to find someone who could help me repair a watch band;;;;
260;i was barely greeted upon arrival and right away felt like i was bothering them;;;;
261;"the girl behind the counter obviously just wanted me to leave the blond kid working snapped at me when i asked a question and when i re-asked in order to clarify what he said he snapped again and said ""i already told you?!?""  ""is this even authentic?""  shouting at me over his shoulder as he work on something else";;;;
262;i was shocked and just stood there put my watch away awkwardly and left with no one else saying a word to me;;;;
263;there are a lot of places that fix jewelry in this city and i will be taking my business elsewhere and recommend that people reading this review do the same;;;;
264;some places just do not deserve a loyal customer base;;;;
265;their pettuccine was fresh-made in the morning;;;;
266;it was very delicate and yummy! the owner and staffs are super kind and delightful;;;;
267;we also had veal piccata;;;;
268;it was classic! love this restaurant;;;;
269;if i can give this place no stars i would i only had their hot pot though so im not a good judge for anything besides their shabu;;;;
270;i must say quantity was small price is expensive for the quality and quantity and the taste of the soup base is bland as if they just put hot water in;;;;
271;the sauce selection is limited and not very fresh/clean from my perspective;;;;
272;i love hot pot and i would never go back again because home made hot pot can be much better than this place without even trying;;;;
273;anyways if you have a good appetite for hot pot you can do yourself a favor and skip this place because it can make you miserable!;;;;
274;this review is in regards to our experience watching superbowl 51 february 5 2017 at the westgate in the theater/auditorium;;;;
275;watch the game somewhere else;;;;
276;to those unfamiliar with the big game experience at westgate you typically would get in line to watch the superbowl in the theater portion of the hotel around 8 am on superbowl sunday;;;;
277;this line can get extremely long yet the earlier you get in line your choice of seating significantly improves;;;;
278;after waiting in line for a few hours we were notified the lower portion of the theater was reserved for paid customers who previously purchased wristbands for $100 (including alcohol and hot dogs) and instead we would be seated in the balcony portion of the theater;;;;
279;no problem something different we said;;;;
280;mistake;;;;
281;so at 1;;;;
282;30 pm we were sent upstairs to the balcony to take our seats and prepare to watch the big game at 3;;;;
283;once we take our seats one of us ( we're in a group of 8 ) will hold the seats while the rest of us will go out to the casino floor and gamble or go the the sports book and place a couple last minute bets;;;;
284;please note the patrons that leave the auditorium will receive a hand stamp or wristband to allow reentry to the theater;;;;
285;but instead;;;;
286;we were told by westgate staff that no hand stamps or wristbands would be given and we were on our own if we choose to leave and we would not be allowed back in;;;;
287;wow;;;;
