;review_text;sentiment;price;service;food
7506;they usually bring the dogs little dog bowls with water and sometimes even a cookie!  try the coca cola ham omelet for brunch;;;;
7507;ah-mazing!;;;;
7508;i opened up a business and needed photos taken for my website;;;;
7509;"i told her my vision gave her a couple sample images of what ""look"" we were going for and i just sat back and watched her as she just took off with our concept and did something incredible with it";;;;
7510;michelle is an incredibly talented person;;;;
7511;she picked the best locations and went above and beyond to ensure that our photos and website turned out great! i would recommend her in a heartbeat and she is who i will continue to go to for all our business' photography needs;;;;
7512;thanks michelle!;;;;
7513;7/15/17;;;;
7514;came to vegas to celebrate a milestone birthday - and saturday just seemed to want us to be at encore beach club the entire day/night;;;;
7515;first we attended diplo with some promoter price tickets for the guys and the ladies on a free list;;;;
7516;came around 11 to avoid the line - easy-peasy;;;;
7517;we ate there while letting the sunscreen dry then spent the whole afternoon dancing and splashing;;;;
7518;the staff was great the people as well-  there was hard partying but no fights or any such ratchetness just people from all over having the time of our lives;;;;
7519;the rave-booty was twerk-tacular;;;;
7520;there were spankings;;;;
7521;the bartenders seemed to be having more fun than the people drinking;;;;
7522;all i saw were smiles;;;;
7523;you could see diplo from any of the pools except perhaps the front middle as people stand and dance in front of the dj;;;;
7524;we danced with our group of 8 (4 couples) and met plenty of nice people;;;;
7525;as more of my group came in from all over we came back for marshmello saturday night (nightswim!) whom i hadn't seen since edc last year;;;;
7526;we got a great table on a lily-pad off the pool (not on the pool) just in case there was gratuitous splashing we'd want a dry drinking spot haha;;;;
7527;our view was fantastic table was perfect the vip even invited us into the small vip pool behind us;;;;
7528;we got a great package that started with 2 magnums of grey goose which did great for our group;;;;
7529;i was impressed how they handled both my large group (12 on table 14 total that night) and the speed-bump of my credit-card declining as i forgot to tell the bank i was leaving the state;;;;
7530;my host alexia beholder of a supernatural beauty waited patiently and kindly while i called the card and had them over-ride the security hold;;;;
7531;"she was calm and pleasant and simply said ""this happens all the time";;;;
7532;""" (this was in stark contrast to the treatment at omnia the night before where the bartender threatened to have my friend arrested when his card declined)";;;;
7533;alexia and her runner damn i totally forgot his name (even he was a really nice guy) treated us incredibly well;;;;
7534;she came back and poured drinks throughout the night not just the obligatory first round;;;;
7535;they also made sure we stayed hydrated! super important when it's 100 at night;;;;
7536;they gave us just the right amount of attention and class;;;;
7537;thank you guys and special thanks to alvin for the rockstar treatment at the door;;;;
7538;saturday night was the cherry on top of my birthday weekend!! truly i don't expect anything less from encore/wynn (xs surrender/encore beach club) - i never get anything less than the best experience there over the span of years that i have both attended with tickets and tables;;;;
7539;they are the best they will always be the best;;;;
7540;thanks again!;;;;
7541;the gelato here is sent from the gods themselves;;;;
7542;just kidding;;;;
7543;desyree makes everything that goes into the gelato herself;;;;
7544;same difference right?;;;;
7545;i am thrilled i found this place! dr;;;;
7546;brown and his staff are wonderful! dr;;;;
7547;brown spent a lot of time on the examination and answered our many questions;;;;
7548;i appreciated that he didn't push any unnecessary services or products on us;;;;
7549;he found a lump on one of our cats and told us just to monitor it and bring him back in if it gets any worse rather than opting to run a bunch of expensive tests on him immediately;;;;
7550;we brought our cat in about a month later to have the tests done and he was very upfront about the cost and what they were testing for;;;;
7551;i also like that they send you an appointment reminder text the day before;;;;
7552;their prices are reasonable and the first exam is free;;;;
7553;this is the only place i'll be bringing my cats to from now on!;;;;
7554;this is my go-to grocery store when i am too lazy to head to winco;;;;
7555;i have been here well over a hundred times and the experience is pretty standard for smith's stores in my experience;;;;
7556;i have never had a problem with stocking here which is good;;;;
7557;items are always stocked well regardless of when in the week you come;;;;
7558;i am not the biggest fan of their produce however;;;;
7559;about 20% of the time i bring how green beans or asparagus and two days later they are covered in mold (and no it is not my refrigerator);;;;
7560;so i no longer purchase produce here except for when i am in a bind;;;;
7561;store is also always clean i have never once seen a spill or poorly arranged merchandise which is a testament to the hard working staff;;;;
7562;the staff are always very helpful and friendly;;;;
7563;they don't always have enough baggers but last time i was there they had plenty and wouldn't even let me unload my cart (they had a separate person in the aisle that unloaded people's carts for them);;;;
7564;first time i've experienced that and it was pretty great;;;;
7565;prices are a bit on the high side overall i would not shop here if you do not use your smith's card;;;;
7566;the prices are outrageous with out it;;;;
7567;however they end up being pretty reasonable when you remember to use the gas points (which is now made easier by the smith's gas station located directly in front of this store);;;;
7568;they definitely need way more cart corrals in the parking lot;;;;
7569;like at least double the amount they currently have;;;;
7570;there are none closer to the gas station and when the store is busy people are too lazy to walk their carts back to the corrals and i've seen carts fly into parked cars on at least three separate occasions;;;;
7571;i hope smith's management reads this review and fixes this problem soon;;;;
7572;it's been about two weeks since omar did my window tint;;;;
7573;it looks great he had to scrap off old nasty window tint that started to bubble;;;;
7574;the work they do is awesome this is the 3rd vehicle he has done for me;;;;
7575;i've been very happy every time;;;;
7576;i'll for sure always keep my business with him;;;;
7577;prices are fair but the quality and professional service speaks for itself;;;;
7578;thanks omar;;;;
7579;nestled in what is (for now) a relatively sleepy corner of downtown urban bodega (aka urbo) feels like something of a throwback to some of the small convenience stores i used to see line the roosevelt row neighborhood;;;;
7580;back when downtown was still a neighborhood where only the most diehard entrepreneurs dared to tread you could find one of these small neighborhood shops selling everything from wine and beer to snacks to cooking essentials and even a few household cleaning items;;;;
7581;the relatively new pure fillmore apartment complex is currently the first of what will undoubtedly be many new apartment and condo complexes lining 7th avenue in downtown;;;;
7582;but for now the nearest full sized grocery store requires a car;;;;
7583;all the more reason urbo's location makes sense;;;;
7584;you'll find urbo on the bottom floor of the pure fillmore apartments on fillmore street just east of 7th avenue;;;;
7585;the brainchild of desoto central market alum shawn connelly you enter here through the front patio area (where there's seating for eight by the way);;;;
7586;inside its a whole lot of stuff mixed into a small space;;;;
7587;behind the counter you can get coffee tea or even a sandwich made on the spot;;;;
7588;in front of the counter it's essentially a small independent convenience store with many of the things you'd expect;;;;
7589;candy bars meds condiments snacks microwavable items beer wine soda as well as odds and ends like tissue paper shampoo and storage bags;;;;
7590;i can well imagine some downtown college students living in the apartments upstairs too hung over or too tired to drive two miles to safeway and instead opting for a stop here;;;;
7591;for my first stop here on a saturday morning i opted to get a quick morning pick me up;;;;
7592;a tea and a sandwich;;;;
7593;i got their salted caramel iced tea (also available hot) and their turkey sausage egg & cheese sandwich on an english muffin;;;;
7594;both made to order;;;;
7595;total cost including tax;;;;
7596;$10;;;;
7597;now to be fair they prepared the sandwich in part using a microwave so we're not talking gourmet here;;;;
7598;still the sandwich hit the spot and the sausage in particular was very tasty;;;;
7599;i was also very happy with the tea;;;;
7600;almost tasted like a southern style sweet tea of sorts with those caramel accents;;;;
7601;a solid breakfast;;;;
7602;so there you have it;;;;
7603;a locally owned business filling a need in an emerging neighborhood;;;;
7604;nothing pretentious;;;;
7605;just a good straight forward progressive independent convenience store;;;;
7606;even if you don't live in this quiet corner of downtown its worth a look;;;;
7607;or a sip and bite and it was in my case;;;;
7608;fitness together;;;;
7609;i can say nothing but positive things about my experience at fitness together steele creek;;;;
7610;the facility is clean and well equipped and the staff is knowledgeable and full of personality;;;;
7611;when my wife and i first showed up we had a deal to try five sessions for 99 dollars;;;;
7612;we had talked for a while about joining a gym but fitness together is so much more;;;;
7613;it's like a community of people working toward a common goal of getting fit and taking control of their health;;;;
7614;the owner joe is very knowledgeable in fitness exercise and most importantly nutrition;;;;
7615;he worked with us to set up individual  nutrition plans and exercise programs to help us attain our goals;;;;
7616;included with your sessions purchase is a fitness assessment which measures body fat percentage fitness levels resting heart rate flexibility and a few other factors;;;;
7617;additional assessments are given throughout your tenure as a fitness together member so you can watch your total body transformation;;;;
7618;it is a very encouraging atmosphere no matter your current level of fitness;;;;
7619;at first i dreaded going to exercise but after seeing the positive changes you just can't wait to get back;;;;
7620;i like the fact that sessions can be purchased in packages without a long term commitment but i must say i continue to add additional sessions;;;;
7621;this is mainly because i continue to see results;;;;
7622;my wife and i are both stronger healthier and happier thanks to joe and his knowledgeable and helpful staff;;;;
7623;i highly recommend fitness together to anyone looking to get into shape tone up lose some inches or lbs;;;;
7624;it's been a great experience;;;;
7625;went to alchemy today because my friend was craving a burger;;;;
7626;i had never dined here before but she had and suggested it;;;;
7627;i was thoroughly impressed;;;;
7628;she had the bison burger which was to die for i had a bite and instantly wanted another;;;;
7629;i ordered the blft and it was loaded with bacon and flavor;;;;
7630;i had some minor issues with it first being that there was just a little too much aioli on the bread and second that the fried tomato was a red tomato and not a green tomato;;;;
7631;i just found the texture of the tomato unappetizing;;;;
7632;i also enjoyed their bloody mary and they have a nice local craft beer selection;;;;
7633;for dessert we had the espresso torte and it was one of the best i have ever had;;;;
7634;service was also spot on and i will be returning soon to get the bison burger for myself!;;;;
7635;this was a great find near pittsburgh alternative to down town scene;;;;
7636;ambiance was great on the deck by the river and service was excellent (thanks melisa for history lessens!);;;;
7637;seafood including oysters were fresh and well prepared;;;;
7638;"price was reasonable for ""prefix"" menu including scrumptious dessert";;;;
7639;what an evening to end a fantastic summer day in pittsburgh;;;;
7640;looking for a big hearty breakfast? then look no further because this place has got exactly what you're looking for (and for a pretty reasonable price);;;;
7641;i went here with my friend after a night of *ahem* good old madison weekend fun and this was exactly what we needed;;;;
7642;i got the eggs mornay which has this sausage patty and poached eggs with this very nice sauce on top of an english muffin;;;;
7643;and if that wasn't enough carbs for you it comes with a generous helping of fried potatoes;;;;
7644;good stuff;;;;
7645;also a random note;;;;
7646;despite its appearance as an old fashioned diner i got a very hipster-y vibe from it once i got in;;;;
7647;as convenience stores go this one could be the poster child for what is wrong with the concept;;;;
7648;while the need for procurement of gas is a subject for another forum the food options are fair game;;;;
7649;or in this case more like not fair and lame;;;;
7650;amazing;;;;
7651;brooke and michael are very professional and helpful;;;;
7652;they designed the most beautiful custom wedding invites for me;;;;
7653;they incorporated all of the elements that i asked for and made any changes that i asked for promptly;;;;
7654;it was a little on the expensive side for wedding invites but you get what you pay for and i know i couldn't have done it without them;;;;
7655;they produced exactly what i wanted;;;;
7656;very happy! even my vendors asked if they could have one of the invites!;;;;
7657;nothing special here;;;;
7658;it's about what you'd expect out of a mongolian barbecue style chain;;;;
7659;choose your base meat and carbohydrate (but not portions that is set) add your choice of vegetables then watch them roast it in front of you;;;;
7660;i went with chicken and rice noodles and a ginger garlic sauce;;;;
7661;the finished product tasted like propane;;;;
7662;the guys frying everything up work hard but their efforts are about the best thing you can say about this place;;;;
7663;i still like it better than noodlecat though as it doesn't seem to take itself seriously;;;;
7664;many of the kanji on the wall are backwards/upside down;;;;
7665;loved this place!;;;;
7666;the food was very good and the drinks were fantastic but more importantly the service was outstanding;;;;
7667;we all started with cocktails - margaritas and mojitos;;;;
7668;the margarita was made with bourbon and rimed with crushed bacon and salt (yes i said bacon);;;;
7669;the mojitos were fresh and minty;;;;
7670;the one thing i we all really like about the drinks was that they were not too sweet;;;;
7671;we ordered two apps for the table - lobster fritters and braised beef short rib poutine;;;;
7672;omg the poutine was out of this world!!  the fritters were good but there was no lobster flavor;;;;
7673;i think next time i would just order the vegetable fritters;;;;
7674;for mains we had fried fish tacos steak burrito jambalaya and grilled pork chop with red potato salad;;;;
7675;the jambalaya and the pork chop were features;;;;
7676;the burritos was very nice;;;;
7677;the steak was a nice medium rare and it came with guacamole and lime crema;;;;
7678;fish tacos were delish!  the corn tortillas really make a difference;;;;
7679;the pork chop feature was really good;;;;
7680;my friend found it to be a little fatty but for those of us who love pork fat it was perfect;;;;
7681;the only dish that fell short was the jambalya;;;;
7682;the sausage in the dish had great flavor but the overall dish didn't seem to come together;;;;
7683;you would think by now we would be full but we sucked it up and ordered dessert;;;;
7684;two sweet potato pies beignets and a patron creme brulee;;;;
7685;my word it was good;;;;
7686;the sweet potato pie was more of a bread pudding with a bourbon carmel sauce;;;;
7687;the creme brulee was one of the best i've had - it had a lovely fresh citrus flavor;;;;
7688;the beignets were tougher than i expected but still good;;;;
7689;i would like to point something out about this place;;;;
7690;no the food isn't cheap but the quality of the ingredients justifies the cost;;;;
7691;our meal with tax and tip was $200 (for four);;;;
7692;the food was really good but what sets them apart is the service;;;;
7693;the restuarant was fairly busy and there was only one waiter who had the assitance of the owners amy and albert;;;;
7694;yes there were times when we seemed to be waiting awhile for things but they made sure that we never felt forgotton;;;;
7695;they went out of their way to talk to us and make us feel welcome;;;;
7696;i've been to some really nice restaurants and had some incredible food but i've never been made to feel as welcome as did at the combine eatery;;;;
7697;we arrived here at 10;;;;
7698;00am and weren't able to get a full tour until 1;;;;
7699;00pm so we opted for the mini tour;;;;
7700;it was very informative and interesting;;;;
7701;it starts with a brief video about the dam which lasts about 10 minutes;;;;
7702;then you are led to a line where you wait for your tour to begin;;;;
7703;the take you down the elevator into the depths of the dam;;;;
7704;you get to see all the workings and information about how it was built;;;;
7705;the our guides are entertaining as well- as dam entertaining as you can be about a dam tour;;;;
7706;lol;;;;
7707;after the tour concludes you are allowed to walk outside and see the dam from a great viewpoint;;;;
7708;awesome time to take pictures and really enjoy the massive beauty of this place;;;;
7709;there is also a small exhibit inside which tells you more about how hoover dam was built and what it took;;;;
7710;it is so amazing that people built this place so long ago and the horrendous conditions they had to endure;;;;
7711;just standing outside in late july- temperatures topped 106 but in the sun it felt like 120;;;;
7712;once you are done exploring the inside exhibits and views you can wander outside and walk the dam;;;;
7713;beware that when you leave the dam touring area you cannot return it is a one way only exit;;;;
7714;i recommend bringing lots of waters and hats as the heat made exploring the dam outside almost unbearable;;;;
7715;after checking the outside of the dam we walked over to little souvenir shop and bought some items;;;;
7716;by that time we were hot and starved so we stopped at the small deli/snack shop at the dam and snagged a table to eat lunch;;;;
7717;beware it can get very crowded;;;;
7718;we ordered a small deli sandwich and some chicken tenders/fries for the kids;;;;
7719;tip;;;;
7720;bring your own bagged lunch and sit on the shaded areas/benches during your walk of the dam to really enjoy the experience;;;;
7721;there is a subway on your drive in to stop at;;;;
7722;this was a memorable amazing visit and is one of those places you see that you will remember forever;;;;
7723;sucks;;;;
7724;i'm there trying to buy texture for paint and four guys in that department are all busy bullshitting except for the black man that is there to work and help people;;;;
7725;also i bought a toilet a month ago and they said someone would contact me in two days;;;;
7726;a little over two weeks after my son and i ended up installing it they called;;;;
7727;one star because i had too;;;;
7728;i will never rent from budget rent a car again;;;;
7729;i got totally ripped off by their employee at the phoenix airport location on 5/3/18;;;;
7730;he added the fuel surcharge of $40+ to my bill despite specifically being told i didn't want that i would fill the car up with gas myself before returning the car;;;;
7731;he also told me insurance would be $30 not specifying that it would be $30 + taxes for each day i had the car;;;;
7732;"when i asked how my $61 booking (on costco) became a $200+ rental he told me ""arizona has a lot of taxes""";;;;
7733;given that it took so long to wait and then for him to prepare the contract i did not read everything---i had my 87 year old father in a wheelchair with me;;;;
7734;when i complained to budget later i was told sorry you signed the contract;;;;
7735;shady shady business;;;;
7736;the staff is very nice and helpful but there pricing sucks!!!!! very over priced;;;;
7737;i went with my wife and my sister and brother in law we all wanted to get tattoos;;;;
7738;i have 6 so i am fairly familiar with tattoo pricing;;;;
7739;long story short why wife wanted a small piece that should be around $75 to vegas price maybe $150;;;;
7740;they wanted $350 bucks! they must be joking right my piece that should be maybe $150-200 they wanted $750;;;;
7741;the point is that they apparently think that the ink is liquid gold or something;;;;
7742;truly enjoyed working with fred lembo! we just closed on our first home and couldn't be happier with fred and his team;;;;
7743;no matter what happened in the process he did not let us down;;;;
7744;he always had our backs made sure that we understood all routes and options and made the process fun and exciting;;;;
7745;unlike other agents that we had worked with fred never made us feel like he was reluctant to show us properties;;;;
7746;"he was very patient with us throughout the process and gave us time and space to make decisions all while going above and beyond in the ""background"" to be prepared for all scenarios so that we were always ""ready to go"" when needed";;;;
7747;fred is also an excellent negotiator and helped us feel confident and comfortable with what could have otherwise been some very overwhelming circumstances;;;;
7748;we would highly recommend fred to anyone purchasing or selling a home;;;;
7749;it was a privilege to work with him shannan and the rest of the north&co team!;;;;
7750;the atmosphere may be what you'd expect of a bar in the middle of a suburban development but the food and drink are pretty good;;;;
7751;our friends love their beer we gushed over their root beer;;;;
7752;the malted berry drink was perfect for lightweights;;;;
7753;the wisco porker pizza was tasty and full of meat - just as you would want and expect;;;;
7754;nice bonus - free shots after touchdowns during badger games;;;;
7755;woop!;;;;
7756;atmosphere is nice decor is cute and staff is really nice;;;;
7757;the most important thing is that the food is bomb;;;;
7758;i got a buche taco al pastor taco and mexican corn on the cob;;;;
7759;the al pastor taco was the best out of all of them with lots of juicy meat despite it looking weird and dry on the meat spinner (is that what it's called?);;;;
7760;buche taco didn't have as much meat which was kinda sad;;;;
7761;the corn was delicious however the amount of parmesan cheese on top killed it a bit;;;;
7762;the mole fries are amazing;;;;
7763;ten out of ten will come back for them;;;;
7764;we love this pastries shop during our stayed in montreal;;;;
7765;i tried a few other bakeries near the area i don't believe in going back to the same place twice when exploring a new town;;;;
7766;however this place is so good;;;;
7767;they have the most amazing chocolate croissant almond croissant blueberry tart and not to mention their specialty kouign amann;;;;
7768;the only thing that we didn't like was the apple turnover( a little tart for our taste) and the cafe au lait(a little on the light side);;;;
7769;loco patrãµn is my favorite mexican restaurant in the valley;;;;
7770;when i first tried loco patrãµn i wasn't expecting it to be great i figured it would be typical bar food;;;;
7771;but i was blown away by how delicious the food was! the presentation is fabulous and the service is always prompt;;;;
7772;it is a great place to take your friends or family;;;;
7773;i highly recommend it!;;;;
7774;as an ex-nyer i have a pretty high standard of bagel;;;;
7775;these did not disappoint but i wouldn't say they are truly singular in their yumminess;;;;
7776;my review is based solely on these as we did not try the desserts or anything else;;;;
7777;"some of the bagels seemed ""fresher"" than others and if you've ever had a nyc bagel before 8am you know the expectations i have";;;;
7778;i also feel like the bagels were kinda skinny and the holes were big;;;;
7779;i'm used to really fat chewy but pillowy ones;;;;
7780;sigh;;;;
7781;but it really pains me to give anything lower than 4 stars as they have a lot of traditional jewish/nyc deli delicacies which you really don't see out here in lv;;;;
7782;if that is your thing you really should check it out! the rye bread with caraway seeds looked good;;;;
7783;the dessert section also piqued my interest;;;;
7784;please don't get a black & white cookie - hell will freeze over before anyone ever likes those trust me;;;;
7785;the shop is located in the weirdest shopping complex - it feels like a dr's office belongs here;;;;
7786;inside it was pretty poppin' (it was sunday) but the line wasn't bad;;;;
7787;all in all i will be back again to try more;;;;
7788;i'm the first to give any starbucks 5 stars because i am usually a fan;;;;
7789;with that said i am not a huge fan of this location;;;;
7790;first of all i am not sure if this is country wide but they charge 70c cad to add a few drops of soymilk to some cold brew iced coffee which is free in the us;;;;
